{
  "schema_version": "1.0.0",
  "run_id": "displacement-wick-2026-06-21-nq-market-lb20-cd3-pause1-0fc10bf8c286",
  "family": "displacement-wick",
  "label": "market-lb20-cd3-pause1",
  "record_type": "strategy",
  "reported_on": "2026-06-21",
  "normalized_on": "2026-10-29",
  "configuration_sha256": "0fc10bf8c286aabe65d157c936e91cc5b247270f265ae52a8690e3c5e084f899",
  "script_identity": {
    "library_targets": [
      {
        "project": "scanners/displacement-wick",
        "source_path": "scanners/displacement-wick/DisplacementWickAlerts_Scanner.ts",
        "source_sha256": "fead94d0959f40eb043ac2136047a420e193d61244cdd88377a72b6dcbae0e66",
        "relationship": "related-model"
      },
      {
        "project": "studies/displacement-wick",
        "source_path": "studies/displacement-wick/DisplacementWickAlerts_Study.ts",
        "source_sha256": "aff6d61e92bf191726bebfd142519ffab879a2c62f939cdf4ccf1ff726091082",
        "relationship": "related-model"
      }
    ],
    "tested_model_source_sha256": null,
    "tested_source_hashes": [],
    "tested_model_version": null,
    "inputs": {
      "lookback": 20,
      "cooldown_bars": 3,
      "loss_pause_enabled": true,
      "loss_pause_bars": 20,
      "target_r": 1.5,
      "breakeven": false,
      "trend_gate": false
    }
  },
  "test_environment": {
    "engine": "python",
    "engine_version": null,
    "instrument": "NQ",
    "aggregation_minutes": 5,
    "session": null,
    "timezone": "America/New_York",
    "chart_type": "time bars",
    "native_thinkorswim_performance_verified": false
  },
  "dataset": {
    "provider": null,
    "start": "2026-04-20",
    "end": "2026-05-11",
    "reported_period": null,
    "missing_data_treatment": null,
    "rollover_treatment": null,
    "raw_data_hash": null
  },
  "execution": {
    "entry_rule": "Market next bar in related Pine/Python port.",
    "exit_rule": "Related model ATR stop and 1.5R target; not the current TOS sweep detector.",
    "position_sizing": null,
    "same_bar_stop_target": null,
    "initial_capital_usd": null,
    "overlap_rule": null
  },
  "costs": {
    "currency": "USD",
    "commission_round_trip_usd": null,
    "slippage_points_each_side": null,
    "total_round_trip_usd": null,
    "total_round_trip_points": null,
    "pnl_basis": "unspecified",
    "description": "Realistic cost deduction not established by retrieved report."
  },
  "sample": {
    "development_period": null,
    "test_period": null,
    "test_used_in_selection": null,
    "independent_holdout_verified": false
  },
  "evidence": {
    "source_ids": [
      "wick-verification-update"
    ],
    "source_records": {
      "wick-verification-update": {
        "origin": "HOME/Documents/Claude/Projects/JJ Simon Mean Reversion - Prop Firm Automation/strategy_comparison.md",
        "original_sha256": "b371d468fb555cc45f050e04489773c2030bf70dcb57511b868616a4446d3dc7",
        "original_bytes": 11527,
        "evidence": "docs/performance/evidence/wick-verification-update.txt",
        "evidence_sha256": "b371d468fb555cc45f050e04489773c2030bf70dcb57511b868616a4446d3dc7",
        "transformation": "UTF-8 text; BOM removed if present; user home path replaced with [LOCAL_HOME]. Historical report wording preserved, including superseded claims; use the assessment notes."
      }
    }
  },
  "validation": {
    "status": "reported",
    "source_relationship": "related-model",
    "native_parity": "not-verified",
    "lookahead_audit": null,
    "warnings": [
      "16-session NQ input; report describes roughly one month.",
      "Default-throttle verification update supersedes optimistic sandbox/pass-rate claims.",
      "Not the current TOS wick sweep detector; execution costs not established."
    ],
    "unavailable_fields": {
      "script_identity.tested_model_source_sha256": "Not established by the retrieved evidence; not inferred from current library defaults.",
      "script_identity.tested_model_version": "Not established by the retrieved evidence; not inferred from current library defaults.",
      "test_environment.engine_version": "Not established by the retrieved evidence; not inferred from current library defaults.",
      "test_environment.session": "Not established by the retrieved evidence; not inferred from current library defaults.",
      "dataset.provider": "Not established by the retrieved evidence; not inferred from current library defaults.",
      "dataset.reported_period": "Not established by the retrieved evidence; not inferred from current library defaults.",
      "dataset.missing_data_treatment": "Not established by the retrieved evidence; not inferred from current library defaults.",
      "dataset.rollover_treatment": "Not established by the retrieved evidence; not inferred from current library defaults.",
      "dataset.raw_data_hash": "Not established by the retrieved evidence; not inferred from current library defaults.",
      "execution.position_sizing": "Not established by the retrieved evidence; not inferred from current library defaults.",
      "execution.same_bar_stop_target": "Not established by the retrieved evidence; not inferred from current library defaults.",
      "execution.initial_capital_usd": "Not established by the retrieved evidence; not inferred from current library defaults.",
      "execution.overlap_rule": "Not established by the retrieved evidence; not inferred from current library defaults.",
      "sample.development_period": "Not established by the retrieved evidence; not inferred from current library defaults.",
      "sample.test_period": "Not established by the retrieved evidence; not inferred from current library defaults.",
      "sample.test_used_in_selection": "Not established by the retrieved evidence; not inferred from current library defaults.",
      "costs.commission_round_trip_usd": "Cost component not separately established; see costs.description and pnl_basis.",
      "costs.slippage_points_each_side": "Cost component not separately established; see costs.description and pnl_basis.",
      "costs.total_round_trip_usd": "Cost component not separately established; see costs.description and pnl_basis.",
      "costs.total_round_trip_points": "Cost component not separately established; see costs.description and pnl_basis."
    }
  },
  "artifacts": {
    "run": "docs/performance/runs/displacement-wick-2026-06-21-nq-market-lb20-cd3-pause1-0fc10bf8c286/run.json",
    "summary": "docs/performance/runs/displacement-wick-2026-06-21-nq-market-lb20-cd3-pause1-0fc10bf8c286/summary.json",
    "markdown": "docs/performance/runs/displacement-wick-2026-06-21-nq-market-lb20-cd3-pause1-0fc10bf8c286/PERFORMANCE.md",
    "observations": {
      "path": null,
      "kind": "trades",
      "sha256": null,
      "row_count": null,
      "reason": "Observation-level ledger not available in the retrieved evidence; aggregate report only."
    },
    "summary_sha256": "fb95316ba653d77a14618b4698ec016089840efef8709dade4334db663745aef"
  }
}
