{
  "schema_version": "1.0.0",
  "run_id": "orb15-mnq-2026-10-01-mnq-historical-stopcap100-132c2a7fc1d6",
  "family": "orb15-mnq",
  "label": "historical-StopCap100",
  "record_type": "strategy",
  "reported_on": "2026-10-01",
  "normalized_on": "2026-10-29",
  "configuration_sha256": "132c2a7fc1d6ec0425914a9edafa718c714d0a77a7c480dcf6ca59b10772ea15",
  "script_identity": {
    "library_targets": [
      {
        "project": "strategies/orb15-mnq",
        "source_path": "strategies/orb15-mnq/ORB15_MNQ_Research.thinkscript",
        "source_sha256": "99d43201b4d951d2e578cb8d2a10a483ebb41a0d8d9fa5010d4bb60f3a61e5c2",
        "relationship": "related-model"
      }
    ],
    "tested_model_source_sha256": null,
    "tested_source_hashes": [],
    "tested_model_version": null,
    "inputs": {
      "mode": "StopCap100",
      "quantity": 1,
      "target_r": 5,
      "ohlc_path_scenarios": "high-first / low-first historical range"
    }
  },
  "test_environment": {
    "engine": "python",
    "engine_version": null,
    "instrument": "MNQ",
    "aggregation_minutes": 1,
    "session": null,
    "timezone": "America/New_York",
    "chart_type": "time bars",
    "native_thinkorswim_performance_verified": false
  },
  "dataset": {
    "provider": null,
    "start": null,
    "end": null,
    "reported_period": "Five-year historical study; exact dates not established by the guide excerpt.",
    "missing_data_treatment": null,
    "rollover_treatment": null,
    "raw_data_hash": null
  },
  "execution": {
    "entry_rule": "Earlier causal research baseline; queued activation rebound semantics incomplete.",
    "exit_rule": "Earlier OHLC-path model; not rerun after later fixture corrections.",
    "position_sizing": "One MNQ contract.",
    "same_bar_stop_target": null,
    "initial_capital_usd": null,
    "overlap_rule": null
  },
  "costs": {
    "currency": "USD",
    "commission_round_trip_usd": null,
    "slippage_points_each_side": null,
    "total_round_trip_usd": null,
    "total_round_trip_points": null,
    "pnl_basis": "unspecified",
    "description": "Realistic cost deduction not established by retrieved report."
  },
  "sample": {
    "development_period": null,
    "test_period": null,
    "test_used_in_selection": null,
    "independent_holdout_verified": false
  },
  "evidence": {
    "source_ids": [
      "orb-research-guide"
    ],
    "source_records": {
      "orb-research-guide": {
        "origin": "HOME/Documents/Codex/2026-10-01/task-3/ORB15_MNQ_research_guide.md",
        "original_sha256": "cf4c250dfac56e423861b15ede3ab15777403292b62b1932ff0192c16328bd95",
        "original_bytes": 15564,
        "evidence": "docs/performance/evidence/orb-research-guide.txt",
        "evidence_sha256": "cf4c250dfac56e423861b15ede3ab15777403292b62b1932ff0192c16328bd95",
        "transformation": "UTF-8 text; BOM removed if present; user home path replaced with [LOCAL_HOME]. Historical report wording preserved, including superseded claims; use the assessment notes."
      }
    }
  },
  "validation": {
    "status": "historical-unrevalidated",
    "source_relationship": "related-model",
    "native_parity": "not-verified",
    "lookahead_audit": null,
    "warnings": [
      "Older model totals not rerun after queued-activation rebound fixes.",
      "Reported ranges are historical path scenarios, not rigorous bounds or current-file results.",
      "No untouched holdout established."
    ],
    "unavailable_fields": {
      "script_identity.tested_model_source_sha256": "Not established by the retrieved evidence; not inferred from current library defaults.",
      "script_identity.tested_model_version": "Not established by the retrieved evidence; not inferred from current library defaults.",
      "test_environment.engine_version": "Not established by the retrieved evidence; not inferred from current library defaults.",
      "test_environment.session": "Not established by the retrieved evidence; not inferred from current library defaults.",
      "dataset.provider": "Not established by the retrieved evidence; not inferred from current library defaults.",
      "dataset.start": "Not established by the retrieved evidence; not inferred from current library defaults.",
      "dataset.end": "Not established by the retrieved evidence; not inferred from current library defaults.",
      "dataset.missing_data_treatment": "Not established by the retrieved evidence; not inferred from current library defaults.",
      "dataset.rollover_treatment": "Not established by the retrieved evidence; not inferred from current library defaults.",
      "dataset.raw_data_hash": "Not established by the retrieved evidence; not inferred from current library defaults.",
      "execution.same_bar_stop_target": "Not established by the retrieved evidence; not inferred from current library defaults.",
      "execution.initial_capital_usd": "Not established by the retrieved evidence; not inferred from current library defaults.",
      "execution.overlap_rule": "Not established by the retrieved evidence; not inferred from current library defaults.",
      "sample.development_period": "Not established by the retrieved evidence; not inferred from current library defaults.",
      "sample.test_period": "Not established by the retrieved evidence; not inferred from current library defaults.",
      "sample.test_used_in_selection": "Not established by the retrieved evidence; not inferred from current library defaults.",
      "costs.commission_round_trip_usd": "Cost component not separately established; see costs.description and pnl_basis.",
      "costs.slippage_points_each_side": "Cost component not separately established; see costs.description and pnl_basis.",
      "costs.total_round_trip_usd": "Cost component not separately established; see costs.description and pnl_basis.",
      "costs.total_round_trip_points": "Cost component not separately established; see costs.description and pnl_basis."
    }
  },
  "artifacts": {
    "run": "docs/performance/runs/orb15-mnq-2026-10-01-mnq-historical-stopcap100-132c2a7fc1d6/run.json",
    "summary": "docs/performance/runs/orb15-mnq-2026-10-01-mnq-historical-stopcap100-132c2a7fc1d6/summary.json",
    "markdown": "docs/performance/runs/orb15-mnq-2026-10-01-mnq-historical-stopcap100-132c2a7fc1d6/PERFORMANCE.md",
    "observations": {
      "path": null,
      "kind": "trades",
      "sha256": null,
      "row_count": null,
      "reason": "Observation-level ledger not available in the retrieved evidence; aggregate report only."
    },
    "summary_sha256": "44377db105d47149c7942adda16980635707848ff6efc3cecd748454d02a4e90"
  }
}
