{
  "schema_version": "1.0.0",
  "run_id": "mtf-ote-2026-07-30-mnq-mym-package-incumbent-fixed-r-211aca54ce22",
  "family": "mtf-ote",
  "label": "package-incumbent-fixed-r",
  "record_type": "strategy",
  "reported_on": "2026-07-30",
  "normalized_on": "2026-10-29",
  "configuration_sha256": "211aca54ce2284ea68631fbf485633a5791892fe3bc129691166ecae6d1fd637",
  "script_identity": {
    "library_targets": [
      {
        "project": "studies/mtf-ote",
        "source_path": "studies/mtf-ote/MTF_OTE_TOS.ts",
        "source_sha256": "c902e38c0fbf821a1f58492ef484339c63d22b8881bde4cfe32a86906f46a212",
        "relationship": "related-model"
      }
    ],
    "tested_model_source_sha256": null,
    "tested_source_hashes": [],
    "tested_model_version": "engine_v3",
    "inputs": {
      "higher_timeframe_minutes": 15,
      "chart_minutes": 1,
      "risk_usd_per_r": 200,
      "max_entries_daily": 5,
      "daily_loss_r": -2.5,
      "daily_profit_r": 4.5,
      "cost_scenario": "incumbent-fixed-r"
    }
  },
  "test_environment": {
    "engine": "python",
    "engine_version": null,
    "instrument": "MNQ+MYM",
    "aggregation_minutes": 1,
    "session": null,
    "timezone": "America/New_York",
    "chart_type": "time bars",
    "native_thinkorswim_performance_verified": false
  },
  "dataset": {
    "provider": null,
    "start": null,
    "end": null,
    "reported_period": "61 calendar months, June 2021–June 2026; endpoint months partial.",
    "missing_data_treatment": null,
    "rollover_treatment": null,
    "raw_data_hash": null
  },
  "execution": {
    "entry_rule": null,
    "exit_rule": null,
    "position_sizing": "Related package uses risk-sized actual quantities, 1R=$200.",
    "same_bar_stop_target": "stop-first",
    "initial_capital_usd": null,
    "overlap_rule": null
  },
  "costs": {
    "currency": "USD",
    "commission_round_trip_usd": null,
    "slippage_points_each_side": null,
    "total_round_trip_usd": null,
    "total_round_trip_points": null,
    "pnl_basis": "net",
    "description": "Incumbent fixed R cost: MNQ 0.060R, MYM 0.149R; 1R=$200."
  },
  "sample": {
    "development_period": null,
    "test_period": null,
    "test_used_in_selection": null,
    "independent_holdout_verified": false
  },
  "evidence": {
    "source_ids": [
      "mtf-cost-rebaseline",
      "mtf-clean-rescore"
    ],
    "source_records": {
      "mtf-cost-rebaseline": {
        "origin": "HOME/Documents/Trading Code Library/ChatGPT Trading Scripts/mtf-ote-tos/backtests/2026-07-30_leak_restamp_and_clean_rebaseline.md",
        "original_sha256": "0895b9d95de87ebb5bbbdcf42527f06a83e986b26647c82d02994a0be1bf0cb8",
        "original_bytes": 12269,
        "evidence": "docs/performance/evidence/mtf-cost-rebaseline.txt",
        "evidence_sha256": "0895b9d95de87ebb5bbbdcf42527f06a83e986b26647c82d02994a0be1bf0cb8",
        "transformation": "UTF-8 text; BOM removed if present; user home path replaced with [LOCAL_HOME]. Historical report wording preserved, including superseded claims; use the assessment notes."
      },
      "mtf-clean-rescore": {
        "origin": "HOME/Documents/Trading Code Library/ChatGPT Trading Scripts/mtf-ote-tos/backtests/2026-07-27_incumbent_clean_engine_rescore.md",
        "original_sha256": "b0e784445a906176ff4fa17ffe732d30a73d8f1f7d246b1752fb88d707a7f4e1",
        "original_bytes": 11948,
        "evidence": "docs/performance/evidence/mtf-clean-rescore.txt",
        "evidence_sha256": "b0e784445a906176ff4fa17ffe732d30a73d8f1f7d246b1752fb88d707a7f4e1",
        "transformation": "UTF-8 text; BOM removed if present; user home path replaced with [LOCAL_HOME]. Historical report wording preserved, including superseded claims; use the assessment notes."
      }
    }
  },
  "validation": {
    "status": "reported",
    "source_relationship": "related-model",
    "native_parity": "not-verified",
    "lookahead_audit": "Clean engine audit reported in saved sources; no new independent rerun.",
    "warnings": [
      "Package-level modeled dollars; not standalone-study or account returns.",
      "Month/trailing slices overlap; do not sum.",
      "Older leak-derived live-ready claims voided."
    ],
    "unavailable_fields": {
      "script_identity.tested_model_source_sha256": "Not established by the retrieved evidence; not inferred from current library defaults.",
      "test_environment.engine_version": "Not established by the retrieved evidence; not inferred from current library defaults.",
      "test_environment.session": "Not established by the retrieved evidence; not inferred from current library defaults.",
      "dataset.provider": "Not established by the retrieved evidence; not inferred from current library defaults.",
      "dataset.start": "Not established by the retrieved evidence; not inferred from current library defaults.",
      "dataset.end": "Not established by the retrieved evidence; not inferred from current library defaults.",
      "dataset.missing_data_treatment": "Not established by the retrieved evidence; not inferred from current library defaults.",
      "dataset.rollover_treatment": "Not established by the retrieved evidence; not inferred from current library defaults.",
      "dataset.raw_data_hash": "Not established by the retrieved evidence; not inferred from current library defaults.",
      "execution.entry_rule": "Not established by the retrieved evidence; not inferred from current library defaults.",
      "execution.exit_rule": "Not established by the retrieved evidence; not inferred from current library defaults.",
      "execution.initial_capital_usd": "Not established by the retrieved evidence; not inferred from current library defaults.",
      "execution.overlap_rule": "Not established by the retrieved evidence; not inferred from current library defaults.",
      "sample.development_period": "Not established by the retrieved evidence; not inferred from current library defaults.",
      "sample.test_period": "Not established by the retrieved evidence; not inferred from current library defaults.",
      "sample.test_used_in_selection": "Not established by the retrieved evidence; not inferred from current library defaults.",
      "costs.commission_round_trip_usd": "Cost component not separately established; see costs.description and pnl_basis.",
      "costs.slippage_points_each_side": "Cost component not separately established; see costs.description and pnl_basis.",
      "costs.total_round_trip_usd": "Cost component not separately established; see costs.description and pnl_basis.",
      "costs.total_round_trip_points": "Cost component not separately established; see costs.description and pnl_basis."
    }
  },
  "artifacts": {
    "run": "docs/performance/runs/mtf-ote-2026-07-30-mnq-mym-package-incumbent-fixed-r-211aca54ce22/run.json",
    "summary": "docs/performance/runs/mtf-ote-2026-07-30-mnq-mym-package-incumbent-fixed-r-211aca54ce22/summary.json",
    "markdown": "docs/performance/runs/mtf-ote-2026-07-30-mnq-mym-package-incumbent-fixed-r-211aca54ce22/PERFORMANCE.md",
    "observations": {
      "path": null,
      "kind": "trades",
      "sha256": null,
      "row_count": null,
      "reason": "Observation-level ledger not available in the retrieved evidence; aggregate report only."
    },
    "summary_sha256": "6a486fcb1e2dc248526da3e11abae7d38821b7eaf187baca9b68a5fbbc3e0e04"
  }
}
